{
  "$schema": "https://json-schema.org/draft/2020-12/schema",
  "$id": "https://raw.githubusercontent.com/narcofreccia/ai_model_registry/stable/schema/registry.schema.json",
  "title": "AI Model Registry",
  "description": "Facts-only catalog of AI models: ids, providers, capabilities, current USD list prices, lifecycle status and id migrations. Contains no behavior (request settings, prompts, routing) — consumers own that.",
  "type": "object",
  "required": ["schema_version", "generated_at", "providers", "models", "migrations"],
  "additionalProperties": false,
  "properties": {
    "schema_version": {
      "type": "integer",
      "minimum": 1,
      "description": "MAJOR. Incremented only for breaking changes to this schema."
    },
    "schema_minor": {
      "type": "integer",
      "minimum": 0,
      "description": "MINOR revision within the current major: incremented for additive changes (a new kind, a new optional field, a new pricing shape) that older consumers can ignore. Optional and absent means 0. It is deliberately a separate key rather than a fractional schema_version so adapters typing schema_version as an integer keep loading newer registries."
    },
    "generated_at": {
      "type": "string",
      "description": "ISO-8601 UTC timestamp of the last edit to registry.json."
    },
    "providers": {
      "type": "object",
      "minProperties": 1,
      "additionalProperties": { "$ref": "#/$defs/provider" },
      "description": "Provider key -> provider facts. Model.provider must reference a key here."
    },
    "models": {
      "type": "array",
      "minItems": 1,
      "items": { "$ref": "#/$defs/model" },
      "description": "Ordered list. The order is part of the contract: consumers may render it verbatim."
    },
    "migrations": {
      "type": "object",
      "additionalProperties": { "type": "string" },
      "description": "Stale/retired model id -> successor id. Resolved by chaining until stable (cycle-safe); the final target must be a model id."
    }
  },
  "$defs": {
    "provider": {
      "type": "object",
      "required": ["name", "base_url", "key_env", "pydantic_ai_prefix"],
      "additionalProperties": false,
      "properties": {
        "name": { "type": "string", "description": "Human-readable provider name." },
        "base_url": {
          "type": ["string", "null"],
          "description": "Endpoint base URL. With pydantic_ai_prefix null it is an OpenAI-compatible endpoint the consumer must call directly; with a prefix set it is informational only (the provider's native API root, which the pydantic-ai provider already knows), and null is allowed."
        },
        "key_env": {
          "type": ["string", "null"],
          "description": "Environment variable holding the API key; null for providers needing no key (local)."
        },
        "pydantic_ai_prefix": {
          "type": ["string", "null"],
          "description": "pydantic-ai provider prefix (\"anthropic:model\"); null for a plain OpenAI-compatible endpoint reached via base_url."
        }
      }
    },
    "model": {
      "type": "object",
      "required": [
        "id", "name", "description", "provider", "kind", "api_model_id", "aliases",
        "reasoning", "allows_temperature", "responses_api", "server_web_tools",
        "vision", "needs_pdf_rasterization", "max_reference_images", "voices",
        "status", "pricing"
      ],
      "additionalProperties": false,
      "properties": {
        "id": {
          "type": "string",
          "minLength": 1,
          "description": "Registry-wide unique id. This is the string consumers store and pass around."
        },
        "name": { "type": "string", "description": "Display name." },
        "description": { "type": "string", "description": "Short human-facing blurb." },
        "provider": { "type": "string", "description": "Key into the providers map." },
        "kind": {
          "enum": ["chat", "realtime", "embedding", "image_gen", "decision"],
          "description": "What the model does. `decision` (schema_minor 2) = structured-decision models that answer typed questions about a state with probabilities and never generate text. Consumers must ignore kinds they do not handle."
        },
        "api_model_id": {
          "type": "string",
          "minLength": 1,
          "description": "The exact string sent to the provider API (may differ from id, e.g. a dated snapshot id)."
        },
        "aliases": {
          "type": "array",
          "items": { "type": "string" },
          "uniqueItems": true,
          "description": "Other names that resolve to this model without a migration (equivalent naming, not a successor relationship)."
        },
        "reasoning": {
          "enum": [
            "adaptive", "anthropic_budget", "openai_effort", "google_budget",
            "openrouter_reasoning", "glm_thinking", "none"
          ],
          "description": "How the model exposes reasoning depth. Consumers must degrade unknown future values to \"none\"."
        },
        "allows_temperature": {
          "type": "boolean",
          "description": "False -> the API rejects temperature/top_p/top_k with a 400."
        },
        "responses_api": {
          "type": "boolean",
          "description": "True -> the model requires OpenAI's Responses API endpoint rather than Chat Completions."
        },
        "server_web_tools": {
          "type": "boolean",
          "description": "True -> provider-side web_search/web_fetch tools are available."
        },
        "vision": { "type": "boolean", "description": "Accepts image input." },
        "needs_pdf_rasterization": {
          "type": "boolean",
          "description": "True -> the model cannot ingest PDFs natively; pages must be rasterized to images first."
        },
        "max_reference_images": {
          "type": ["integer", "null"],
          "minimum": 0,
          "description": "Image models: how many reference images the API accepts. Null when not applicable."
        },
        "image_sizes": {
          "type": ["array", "null"],
          "items": { "type": "string", "minLength": 1 },
          "uniqueItems": true,
          "description": "Image models (schema_minor 3): the output size tokens the API accepts, spelled exactly as the API wants them (Gemini [\"512\",\"1K\",\"2K\",\"4K\"], uppercase K). Optional; null/absent when unpublished or not applicable — consumers then omit the size."
        },
        "default_image_size": {
          "type": ["string", "null"],
          "minLength": 1,
          "description": "Image models (schema_minor 3): the size the API uses when none is sent; one of image_sizes. Optional; null/absent when unpublished."
        },
        "aspect_ratios": {
          "type": ["array", "null"],
          "items": { "type": "string", "pattern": "^[0-9]+:[0-9]+$" },
          "uniqueItems": true,
          "description": "Image models (schema_minor 3): the aspect ratios the API documents for this model (\"16:9\"). Optional; null/absent when unpublished — consumers then keep their own list."
        },
        "voices": {
          "type": ["array", "null"],
          "items": { "type": "string" },
          "description": "Realtime/audio models: available voice ids. Null when not applicable."
        },
        "modalities": {
          "type": ["array", "null"],
          "items": { "type": "string" },
          "description": "Realtime/audio models: the modality tokens the provider's realtime session accepts, spelled exactly as the API wants them (OpenAI [\"text\",\"audio\"], Google Live [\"AUDIO\"]). Optional; null/absent when not applicable."
        },
        "question_types": {
          "type": ["array", "null"],
          "items": { "type": "string", "minLength": 1 },
          "uniqueItems": true,
          "description": "Decision models: the question type tokens the API accepts, spelled as the API wants them (TypeSafe [\"noul\",\"choice\",\"score\"]). Open vocabulary. Optional; null/absent on other kinds."
        },
        "max_request_tokens": {
          "type": ["integer", "null"],
          "minimum": 1,
          "description": "Decision models: token budget for one request (state plus every question). Optional; null/absent when not applicable."
        },
        "max_state_question_tokens": {
          "type": ["integer", "null"],
          "minimum": 1,
          "description": "Decision models: token budget for the state plus the single longest question. Optional; null/absent when not applicable."
        },
        "max_choice_options": {
          "type": ["integer", "null"],
          "minimum": 1,
          "description": "Decision models: most options one choice question may carry. Optional; null/absent when not applicable."
        },
        "max_score_levels": {
          "type": ["integer", "null"],
          "minimum": 1,
          "description": "Decision models: most ordered levels one score question may carry. Optional; null/absent when not applicable."
        },
        "status": {
          "enum": ["active", "deprecated", "retired"],
          "description": "Lifecycle. Deprecated/retired ids stay in the registry so old saved ids keep resolving; pair them with a migration."
        },
        "pricing": {
          "oneOf": [
            { "$ref": "#/$defs/token_pricing" },
            { "$ref": "#/$defs/image_pricing" },
            { "$ref": "#/$defs/realtime_pricing" },
            { "type": "null" }
          ],
          "description": "CURRENT USD list price only. Decision models use the token shape (input_per_1m, with output_per_1m 0 when output is free). Null when no verified price is known — never guess. Git history is the price audit trail; this file never carries historical rates."
        }
      }
    },
    "token_pricing": {
      "type": "object",
      "required": ["input_per_1m", "output_per_1m"],
      "additionalProperties": false,
      "properties": {
        "input_per_1m": { "type": "number", "minimum": 0, "description": "USD per 1M input tokens." },
        "output_per_1m": { "type": "number", "minimum": 0, "description": "USD per 1M output tokens." },
        "cached_input_per_1m": {
          "type": ["number", "null"],
          "minimum": 0,
          "description": "USD per 1M cached input tokens; null when the provider publishes no cached rate."
        },
        "effective_from": {
          "type": "string",
          "format": "date",
          "pattern": "^[0-9]{4}-[0-9]{2}-[0-9]{2}$",
          "description": "Optional ISO date on which the current price took effect."
        },
        "variants": {
          "type": "array",
          "items": { "$ref": "#/$defs/token_pricing_variant" },
          "description": "Optional conditional rates (off-peak, batch, long-context...). Consumers MUST ignore variant conditions they do not recognise and fall back to the base rate."
        }
      }
    },
    "token_pricing_variant": {
      "type": "object",
      "required": ["condition"],
      "additionalProperties": false,
      "properties": {
        "condition": {
          "type": "string",
          "minLength": 1,
          "description": "Open vocabulary, e.g. \"off_peak\", \"long_context_gt_200k\", \"batch\", \"audio\". Unknown values must be ignored, not rejected."
        },
        "input_per_1m": { "type": ["number", "null"], "minimum": 0 },
        "output_per_1m": { "type": ["number", "null"], "minimum": 0 },
        "cached_input_per_1m": { "type": ["number", "null"], "minimum": 0 },
        "note": { "type": "string", "description": "Free-text clarification of when the condition applies." }
      }
    },
    "realtime_pricing": {
      "type": "object",
      "required": [
        "audio_input_per_1m", "audio_output_per_1m",
        "text_input_per_1m", "text_output_per_1m", "cached_input_per_1m"
      ],
      "additionalProperties": false,
      "description": "Realtime/audio models bill audio and text tokens on separate axes. All rates are USD per 1M tokens; a rate the provider does not publish is null, never guessed.",
      "properties": {
        "audio_input_per_1m": { "type": ["number", "null"], "minimum": 0, "description": "USD per 1M audio input tokens." },
        "audio_output_per_1m": { "type": ["number", "null"], "minimum": 0, "description": "USD per 1M audio output tokens." },
        "text_input_per_1m": { "type": ["number", "null"], "minimum": 0, "description": "USD per 1M text input tokens." },
        "text_output_per_1m": { "type": ["number", "null"], "minimum": 0, "description": "USD per 1M text output tokens." },
        "cached_input_per_1m": {
          "type": ["number", "null"],
          "minimum": 0,
          "description": "USD per 1M cached input tokens. OpenAI publishes one absolute rate covering both axes; null when the provider publishes none."
        },
        "cached_audio_input_per_1m": {
          "type": ["number", "null"],
          "minimum": 0,
          "description": "Optional: USD per 1M cached AUDIO input tokens, when the provider prices it apart from cached text input. Absent/null means cached_input_per_1m covers both."
        },
        "effective_from": {
          "type": "string",
          "format": "date",
          "pattern": "^[0-9]{4}-[0-9]{2}-[0-9]{2}$",
          "description": "Optional ISO date on which the current rates took effect."
        }
      }
    },
    "image_pricing": {
      "type": "object",
      "required": ["per_image"],
      "additionalProperties": false,
      "properties": {
        "per_image": { "type": "number", "minimum": 0, "description": "USD per generated image." },
        "effective_from": {
          "type": "string",
          "format": "date",
          "pattern": "^[0-9]{4}-[0-9]{2}-[0-9]{2}$",
          "description": "Optional ISO date on which the current price took effect."
        },
        "variants": {
          "type": "array",
          "items": { "$ref": "#/$defs/image_pricing_variant" },
          "description": "Optional conditional per-image rates (quality tier, resolution...). Unknown conditions must be ignored."
        }
      }
    },
    "image_pricing_variant": {
      "type": "object",
      "required": ["condition"],
      "additionalProperties": false,
      "properties": {
        "condition": { "type": "string", "minLength": 1 },
        "per_image": { "type": ["number", "null"], "minimum": 0 },
        "note": { "type": "string" }
      }
    }
  }
}
