{
  "schema_version": 1,
  "schema_minor": 3,
  "generated_at": "2026-10-26T12:00:00Z",
  "providers": {
    "anthropic": {
      "name": "Anthropic",
      "base_url": null,
      "key_env": "ANTHROPIC_API_KEY",
      "pydantic_ai_prefix": "anthropic"
    },
    "openai": {
      "name": "OpenAI",
      "base_url": null,
      "key_env": "OPENAI_API_KEY",
      "pydantic_ai_prefix": "openai"
    },
    "google": {
      "name": "Google",
      "base_url": null,
      "key_env": "GOOGLE_API_KEY",
      "pydantic_ai_prefix": "google"
    },
    "openrouter": {
      "name": "OpenRouter",
      "base_url": null,
      "key_env": "OPENROUTER_API_KEY",
      "pydantic_ai_prefix": "openrouter"
    },
    "zai": {
      "name": "Z.ai",
      "base_url": "https://api.z.ai/api/paas/v4",
      "key_env": "ZAI_API_KEY",
      "pydantic_ai_prefix": null
    },
    "typesafe": {
      "name": "TypeSafe",
      "base_url": "https://api.typesafe.ai",
      "key_env": "TYPESAFE_API_KEY",
      "pydantic_ai_prefix": "typesafe"
    },
    "local": {
      "name": "Local",
      "base_url": null,
      "key_env": null,
      "pydantic_ai_prefix": null
    }
  },
  "models": [
    {
      "id": "claude-opus-5",
      "name": "Claude Opus 5",
      "description": "Most capable Opus. Adaptive thinking; best default for hard work.",
      "provider": "anthropic",
      "kind": "chat",
      "api_model_id": "claude-opus-5",
      "aliases": [],
      "reasoning": "adaptive",
      "allows_temperature": false,
      "responses_api": false,
      "server_web_tools": true,
      "vision": true,
      "needs_pdf_rasterization": false,
      "max_reference_images": null,
      "voices": null,
      "status": "active",
      "pricing": {
        "input_per_1m": 5.0,
        "output_per_1m": 25.0,
        "cached_input_per_1m": 0.5
      }
    },
    {
      "id": "claude-sonnet-5",
      "name": "Claude Sonnet 5",
      "description": "Near-Opus quality at Sonnet cost. Adaptive thinking on by default.",
      "provider": "anthropic",
      "kind": "chat",
      "api_model_id": "claude-sonnet-5",
      "aliases": [],
      "reasoning": "adaptive",
      "allows_temperature": false,
      "responses_api": false,
      "server_web_tools": true,
      "vision": true,
      "needs_pdf_rasterization": false,
      "max_reference_images": null,
      "voices": null,
      "status": "active",
      "pricing": {
        "input_per_1m": 2.0,
        "output_per_1m": 10.0,
        "cached_input_per_1m": 0.2
      }
    },
    {
      "id": "claude-haiku-4-5",
      "name": "Claude Haiku 4.5",
      "description": "Fast and affordable. Extended thinking via token budget.",
      "provider": "anthropic",
      "kind": "chat",
      "api_model_id": "claude-haiku-4-5",
      "aliases": [],
      "reasoning": "anthropic_budget",
      "allows_temperature": true,
      "responses_api": false,
      "server_web_tools": false,
      "vision": true,
      "needs_pdf_rasterization": false,
      "max_reference_images": null,
      "voices": null,
      "status": "active",
      "pricing": {
        "input_per_1m": 1.0,
        "output_per_1m": 5.0,
        "cached_input_per_1m": 0.1
      }
    },
    {
      "id": "claude-fable-5",
      "name": "Claude Fable 5",
      "description": "Anthropic's most capable model (premium tier). Thinking always on; requires 30-day data retention on the org.",
      "provider": "anthropic",
      "kind": "chat",
      "api_model_id": "claude-fable-5",
      "aliases": [],
      "reasoning": "adaptive",
      "allows_temperature": false,
      "responses_api": false,
      "server_web_tools": true,
      "vision": true,
      "needs_pdf_rasterization": false,
      "max_reference_images": null,
      "voices": null,
      "status": "active",
      "pricing": {
        "input_per_1m": 10.0,
        "output_per_1m": 50.0,
        "cached_input_per_1m": 1.0
      }
    },
    {
      "id": "gpt-5.6-sol",
      "name": "GPT-5.6 Sol",
      "description": "Frontier tier for the most demanding assignments. Prompts over 272K input tokens are billed at the long_context variant. Promotional price, published as available at least through 2026-11-21; no post-promotion rate published.",
      "provider": "openai",
      "kind": "chat",
      "api_model_id": "gpt-5.6-sol",
      "aliases": [],
      "reasoning": "openai_effort",
      "allows_temperature": false,
      "responses_api": true,
      "server_web_tools": true,
      "vision": true,
      "needs_pdf_rasterization": false,
      "max_reference_images": null,
      "voices": null,
      "status": "active",
      "pricing": {
        "input_per_1m": 4.0,
        "output_per_1m": 20.0,
        "cached_input_per_1m": 0.4,
        "variants": [
          {
            "condition": "long_context_gt_272k",
            "input_per_1m": 8.0,
            "output_per_1m": 30.0,
            "cached_input_per_1m": 0.8,
            "note": "Prompts with more than 272K input tokens: 2x input and cache rates, 1.5x output."
          }
        ]
      }
    },
    {
      "id": "gpt-5.6-terra",
      "name": "GPT-5.6 Terra",
      "description": "Balanced tier: strong performance at everyday efficiency. Prompts over 272K input tokens are billed at the long_context variant.",
      "provider": "openai",
      "kind": "chat",
      "api_model_id": "gpt-5.6-terra",
      "aliases": [],
      "reasoning": "openai_effort",
      "allows_temperature": false,
      "responses_api": true,
      "server_web_tools": true,
      "vision": true,
      "needs_pdf_rasterization": false,
      "max_reference_images": null,
      "voices": null,
      "status": "active",
      "pricing": {
        "input_per_1m": 2.0,
        "output_per_1m": 12.0,
        "cached_input_per_1m": 0.2,
        "variants": [
          {
            "condition": "long_context_gt_272k",
            "input_per_1m": 4.0,
            "output_per_1m": 18.0,
            "cached_input_per_1m": 0.4,
            "note": "Prompts with more than 272K input tokens: 2x input and cache rates, 1.5x output."
          }
        ]
      }
    },
    {
      "id": "gpt-5.6-luna",
      "name": "GPT-5.6 Luna",
      "description": "Fast, affordable tier for high-volume tasks and subagents. Prompts over 272K input tokens are billed at the long_context variant.",
      "provider": "openai",
      "kind": "chat",
      "api_model_id": "gpt-5.6-luna",
      "aliases": [],
      "reasoning": "openai_effort",
      "allows_temperature": false,
      "responses_api": true,
      "server_web_tools": true,
      "vision": true,
      "needs_pdf_rasterization": false,
      "max_reference_images": null,
      "voices": null,
      "status": "active",
      "pricing": {
        "input_per_1m": 0.2,
        "output_per_1m": 1.2,
        "cached_input_per_1m": 0.02,
        "variants": [
          {
            "condition": "long_context_gt_272k",
            "input_per_1m": 0.4,
            "output_per_1m": 1.8,
            "cached_input_per_1m": 0.04,
            "note": "Prompts with more than 272K input tokens: 2x input and cache rates, 1.5x output."
          }
        ]
      }
    },
    {
      "id": "gemini-3.1-pro-preview",
      "name": "Gemini 3.1 Pro",
      "description": "Google's flagship (preview \u2014 no stable Pro id exists). Thinking budget. Still a preview with no shutdown date (checked 2026-10-26). Prompts over 200K input tokens are billed at the long_context variant.",
      "provider": "google",
      "kind": "chat",
      "api_model_id": "gemini-3.1-pro-preview",
      "aliases": [],
      "reasoning": "google_budget",
      "allows_temperature": true,
      "responses_api": false,
      "server_web_tools": false,
      "vision": true,
      "needs_pdf_rasterization": false,
      "max_reference_images": null,
      "voices": null,
      "status": "active",
      "pricing": {
        "input_per_1m": 2.0,
        "output_per_1m": 12.0,
        "cached_input_per_1m": 0.2,
        "variants": [
          {
            "condition": "long_context_gt_200k",
            "input_per_1m": 4.0,
            "output_per_1m": 18.0,
            "cached_input_per_1m": 0.4,
            "note": "Prompts with more than 200K input tokens."
          }
        ]
      }
    },
    {
      "id": "gemini-3.5-flash",
      "name": "Gemini 3.5 Flash",
      "description": "Deprecated 2026-10-08 and removed from Google's pricing page; requests are auto-routed to gemini-3.6-flash (the named replacement). No shutdown date.",
      "provider": "google",
      "kind": "chat",
      "api_model_id": "gemini-3.5-flash",
      "aliases": [],
      "reasoning": "google_budget",
      "allows_temperature": true,
      "responses_api": false,
      "server_web_tools": false,
      "vision": true,
      "needs_pdf_rasterization": false,
      "max_reference_images": null,
      "voices": null,
      "status": "deprecated",
      "pricing": null
    },
    {
      "id": "gemini-3.1-flash-lite",
      "name": "Gemini 3.1 Flash Lite",
      "description": "Cheapest Gemini 3.1 tier for high-volume utility tasks. Deprecated: shuts down 2027-05-07 (replacement gemini-3.5-flash-lite).",
      "provider": "google",
      "kind": "chat",
      "api_model_id": "gemini-3.1-flash-lite",
      "aliases": [],
      "reasoning": "google_budget",
      "allows_temperature": true,
      "responses_api": false,
      "server_web_tools": false,
      "vision": true,
      "needs_pdf_rasterization": false,
      "max_reference_images": null,
      "voices": null,
      "status": "deprecated",
      "pricing": {
        "input_per_1m": 0.25,
        "output_per_1m": 1.5,
        "cached_input_per_1m": 0.025
      }
    },
    {
      "id": "glm-5.3-flash",
      "name": "GLM-5.3 Flash",